[
  {
    "eligibility_id": "elig_9ab68111f6b5",
    "work_unit_id": "wu_run_ho01_cfg_baseline_root",
    "executor_id": "exec_openrouter_glm",
    "capability_id": "cap_repository_analysis",
    "eligible": true,
    "exclusion_reasons": [],
    "qualification_ref": "qual_openrouter_glm_repository_analysis",
    "checks": {
      "availability": true,
      "policy_compatible": true,
      "budget_compatible": true,
      "authority_compatible": true,
      "context_compatible": true
    },
    "decided_at": "2026-10-21T01:11:39.358Z"
  },
  {
    "eligibility_id": "elig_a58882534430",
    "work_unit_id": "wu_run_ho01_cfg_baseline_root",
    "executor_id": "exec_local_tests",
    "capability_id": "cap_deterministic_verification",
    "eligible": true,
    "exclusion_reasons": [],
    "qualification_ref": "qual_local_tests_deterministic_verification",
    "checks": {
      "availability": true,
      "policy_compatible": true,
      "budget_compatible": true,
      "authority_compatible": true,
      "context_compatible": true
    },
    "decided_at": "2026-10-21T01:11:39.358Z"
  },
  {
    "eligibility_id": "elig_cd8a1be8ad59",
    "work_unit_id": "wu_run_ho01_cfg_baseline_root",
    "executor_id": "exec_unitera_execution_control_fixture",
    "capability_id": "cap_external_execution_control",
    "eligible": true,
    "exclusion_reasons": [],
    "qualification_ref": "qual_unitera_execution_control_fixture_s2b",
    "checks": {
      "availability": true,
      "policy_compatible": true,
      "budget_compatible": true,
      "authority_compatible": true,
      "context_compatible": true
    },
    "decided_at": "2026-10-21T01:11:39.358Z"
  }
]
